{
  "version": 1,
  "generatedAt": "2026-08-27T12:22:24.198Z",
  "source": "data/metro.json#v4",
  "counts": {
    "graphs": 85,
    "stations": 0,
    "edges": 0
  },
  "graphs": {
    "1-UHpQwyNjY64d1vsI4pFHQdT5veU_55k": {
      "fileId": "1-UHpQwyNjY64d1vsI4pFHQdT5veU_55k",
      "city": "Hamburg",
      "country": "Germany",
      "branch": "ours",
      "stations": [],
      "edges": [],
      "lines": {},
      "provenance": {
        "annotatedBy": "seed",
        "annotatedAt": "2026-08-27",
        "tool": "metro_graph_seed.py v1"
      }
    },
    "1-rruGfmI7--fr8QP3Mdr2REsDNpSpVCE": {
      "fileId": "1-rruGfmI7--fr8QP3Mdr2REsDNpSpVCE",
      "city": "Pretoria (Tshwane)",
      "country": "South Africa",
      "branch": "ours",
      "stations": [],
      "edges": [],
      "lines": {},
      "provenance": {
        "annotatedBy": "seed",
        "annotatedAt": "2026-08-27",
        "tool": "metro_graph_seed.py v1"
      }
    },
    "1-vx5m4qhz1CYQ48907Z3FFu4YLedgh4A": {
      "fileId": "1-vx5m4qhz1CYQ48907Z3FFu4YLedgh4A",
      "city": "kolkota",
      "country": "India",
      "branch": "ours",
      "stations": [],
      "edges": [],
      "lines": {},
      "provenance": {
        "annotatedBy": "seed",
        "annotatedAt": "2026-08-27",
        "tool": "metro_graph_seed.py v1"
      }
    },
    "10eaL0XPPhGKKFRodyfcHcgGyzPBRwUFE": {
      "fileId": "10eaL0XPPhGKKFRodyfcHcgGyzPBRwUFE",
      "city": "Glassgow",
      "country": "Scotland",
      "branch": "ours",
      "stations": [],
      "edges": [],
      "lines": {},
      "provenance": {
        "annotatedBy": "seed",
        "annotatedAt": "2026-08-27",
        "tool": "metro_graph_seed.py v1"
      }
    },
    "11cD41SlGrZPIBlY-P64JmWOXwr9oQ6_s": {
      "fileId": "11cD41SlGrZPIBlY-P64JmWOXwr9oQ6_s",
      "city": "Volgograd",
      "country": "Russia",
      "branch": "ours",
      "stations": [],
      "edges": [],
      "lines": {},
      "provenance": {
        "annotatedBy": "seed",
        "annotatedAt": "2026-08-27",
        "tool": "metro_graph_seed.py v1"
      }
    },
    "11dkDlZKvYBCztkOeVzS9rekndJRTiGn1": {
      "fileId": "11dkDlZKvYBCztkOeVzS9rekndJRTiGn1",
      "city": "beijing image",
      "country": "china",
      "branch": "reason_map(exisiting_dataset)",
      "stations": [],
      "edges": [],
      "lines": {},
      "provenance": {
        "annotatedBy": "seed",
        "annotatedAt": "2026-08-27",
        "tool": "metro_graph_seed.py v1"
      }
    },
    "11iJ51FdwDcXXpQdVKwbB0aNwoUWfn-B3": {
      "fileId": "11iJ51FdwDcXXpQdVKwbB0aNwoUWfn-B3",
      "city": "Moscow",
      "country": "Russia",
      "branch": "ours",
      "stations": [],
      "edges": [],
      "lines": {},
      "provenance": {
        "annotatedBy": "seed",
        "annotatedAt": "2026-08-27",
        "tool": "metro_graph_seed.py v1"
      }
    },
    "12QTFOIGxqneJYul7Oay-eqI93xbxliYz": {
      "fileId": "12QTFOIGxqneJYul7Oay-eqI93xbxliYz",
      "city": "rome image",
      "country": "italy",
      "branch": "reason_map(exisiting_dataset)",
      "stations": [],
      "edges": [],
      "lines": {},
      "provenance": {
        "annotatedBy": "seed",
        "annotatedAt": "2026-08-27",
        "tool": "metro_graph_seed.py v1"
      }
    },
    "12R0iKyk94p0pem0z_1E294kYWCibXZBg": {
      "fileId": "12R0iKyk94p0pem0z_1E294kYWCibXZBg",
      "city": "Saint Petersburg",
      "country": "Russia",
      "branch": "ours",
      "stations": [],
      "edges": [],
      "lines": {},
      "provenance": {
        "annotatedBy": "seed",
        "annotatedAt": "2026-08-27",
        "tool": "metro_graph_seed.py v1"
      }
    },
    "135IcfsV9vUEEUDdkPq71nrKYMXTsyx5Z": {
      "fileId": "135IcfsV9vUEEUDdkPq71nrKYMXTsyx5Z",
      "city": "Tehran",
      "country": "Iran",
      "branch": "ours",
      "stations": [],
      "edges": [],
      "lines": {},
      "provenance": {
        "annotatedBy": "seed",
        "annotatedAt": "2026-08-27",
        "tool": "metro_graph_seed.py v1"
      }
    },
    "13Id1evOARrve7R0nEm5S8oBaBtnhEFx1": {
      "fileId": "13Id1evOARrve7R0nEm5S8oBaBtnhEFx1",
      "city": "Siliguri",
      "country": "India",
      "branch": "ours",
      "stations": [],
      "edges": [],
      "lines": {},
      "provenance": {
        "annotatedBy": "seed",
        "annotatedAt": "2026-08-27",
        "tool": "metro_graph_seed.py v1"
      }
    },
    "13n8SdSkKX3lXFWOcI1QRHaI9D6NgjF-I": {
      "fileId": "13n8SdSkKX3lXFWOcI1QRHaI9D6NgjF-I",
      "city": "geneva image",
      "country": "switzerland",
      "branch": "reason_map(exisiting_dataset)",
      "stations": [],
      "edges": [],
      "lines": {},
      "provenance": {
        "annotatedBy": "seed",
        "annotatedAt": "2026-08-27",
        "tool": "metro_graph_seed.py v1"
      }
    },
    "14jq7WX8L8_940ELFT27RdGg4SJYI9yEp": {
      "fileId": "14jq7WX8L8_940ELFT27RdGg4SJYI9yEp",
      "city": "Recife",
      "country": "Brazil",
      "branch": "ours",
      "stations": [],
      "edges": [],
      "lines": {},
      "provenance": {
        "annotatedBy": "seed",
        "annotatedAt": "2026-08-27",
        "tool": "metro_graph_seed.py v1"
      }
    },
    "154zX465TY8b98PBdGakemIhjVKN_YPn3": {
      "fileId": "154zX465TY8b98PBdGakemIhjVKN_YPn3",
      "city": "Graz",
      "country": "Austria",
      "branch": "ours",
      "stations": [],
      "edges": [],
      "lines": {},
      "provenance": {
        "annotatedBy": "seed",
        "annotatedAt": "2026-08-27",
        "tool": "metro_graph_seed.py v1"
      }
    },
    "15_KO4rJ2HUAuLqUdsRTaqggVUiETJw4W": {
      "fileId": "15_KO4rJ2HUAuLqUdsRTaqggVUiETJw4W",
      "city": "guiyang image",
      "country": "china",
      "branch": "reason_map(exisiting_dataset)",
      "stations": [],
      "edges": [],
      "lines": {},
      "provenance": {
        "annotatedBy": "seed",
        "annotatedAt": "2026-08-27",
        "tool": "metro_graph_seed.py v1"
      }
    },
    "16T-X2QTqpFh6Whb-ohtwSHL29BKiAc23": {
      "fileId": "16T-X2QTqpFh6Whb-ohtwSHL29BKiAc23",
      "city": "pune",
      "country": "India",
      "branch": "ours",
      "stations": [],
      "edges": [],
      "lines": {},
      "provenance": {
        "annotatedBy": "seed",
        "annotatedAt": "2026-08-27",
        "tool": "metro_graph_seed.py v1"
      }
    },
    "16lMGtPMQ0_tNExDH8heaTk3j8mJaLRq4": {
      "fileId": "16lMGtPMQ0_tNExDH8heaTk3j8mJaLRq4",
      "city": "Shiraz",
      "country": "Iran",
      "branch": "ours",
      "stations": [],
      "edges": [],
      "lines": {},
      "provenance": {
        "annotatedBy": "seed",
        "annotatedAt": "2026-08-27",
        "tool": "metro_graph_seed.py v1"
      }
    },
    "16qQHbrivIuBlc0TuVKTO4L5buJVs9vCA": {
      "fileId": "16qQHbrivIuBlc0TuVKTO4L5buJVs9vCA",
      "city": "Brasília",
      "country": "Brazil",
      "branch": "ours",
      "stations": [],
      "edges": [],
      "lines": {},
      "provenance": {
        "annotatedBy": "seed",
        "annotatedAt": "2026-08-27",
        "tool": "metro_graph_seed.py v1"
      }
    },
    "180aZHuEJCJLaDsjRjfVcqp_2TNyqmVlO": {
      "fileId": "180aZHuEJCJLaDsjRjfVcqp_2TNyqmVlO",
      "city": "Lahore",
      "country": "Pakistan",
      "branch": "ours",
      "stations": [],
      "edges": [],
      "lines": {},
      "provenance": {
        "annotatedBy": "seed",
        "annotatedAt": "2026-08-27",
        "tool": "metro_graph_seed.py v1"
      }
    },
    "19BnGDZhe4zTIRFIYczqGeZEv_3jwya7Y": {
      "fileId": "19BnGDZhe4zTIRFIYczqGeZEv_3jwya7Y",
      "city": "mumbai",
      "country": "India",
      "branch": "ours",
      "stations": [],
      "edges": [],
      "lines": {},
      "provenance": {
        "annotatedBy": "seed",
        "annotatedAt": "2026-08-27",
        "tool": "metro_graph_seed.py v1"
      }
    },
    "19NmCczuCt9VkmThAs2L2RgnFjfmkRIaR": {
      "fileId": "19NmCczuCt9VkmThAs2L2RgnFjfmkRIaR",
      "city": "xian image",
      "country": "china",
      "branch": "reason_map(exisiting_dataset)",
      "stations": [],
      "edges": [],
      "lines": {},
      "provenance": {
        "annotatedBy": "seed",
        "annotatedAt": "2026-08-27",
        "tool": "metro_graph_seed.py v1"
      }
    },
    "19SkURIUV3N4LU0hbqfo1yyIpXGGhnHq4": {
      "fileId": "19SkURIUV3N4LU0hbqfo1yyIpXGGhnHq4",
      "city": "new york image",
      "country": "america",
      "branch": "reason_map(exisiting_dataset)",
      "stations": [],
      "edges": [],
      "lines": {},
      "provenance": {
        "annotatedBy": "seed",
        "annotatedAt": "2026-08-27",
        "tool": "metro_graph_seed.py v1"
      }
    },
    "19hpn9PAvaGB7L35MdsKN9Qa6D-IHcE_Q": {
      "fileId": "19hpn9PAvaGB7L35MdsKN9Qa6D-IHcE_Q",
      "city": "bengaluru",
      "country": "India",
      "branch": "ours",
      "stations": [],
      "edges": [],
      "lines": {},
      "provenance": {
        "annotatedBy": "seed",
        "annotatedAt": "2026-08-27",
        "tool": "metro_graph_seed.py v1"
      }
    },
    "19s46zTSRc8mCe66mngW7nSAa4erbDRZq": {
      "fileId": "19s46zTSRc8mCe66mngW7nSAa4erbDRZq",
      "city": "Metrorail ooskaap",
      "country": "South Africa",
      "branch": "ours",
      "stations": [],
      "edges": [],
      "lines": {},
      "provenance": {
        "annotatedBy": "seed",
        "annotatedAt": "2026-08-27",
        "tool": "metro_graph_seed.py v1"
      }
    },
    "1AI8FREj0Om39roiDd_sXIRRO_n_l2Se_": {
      "fileId": "1AI8FREj0Om39roiDd_sXIRRO_n_l2Se_",
      "city": "Incheon",
      "country": "South Korea",
      "branch": "ours",
      "stations": [],
      "edges": [],
      "lines": {},
      "provenance": {
        "annotatedBy": "seed",
        "annotatedAt": "2026-08-27",
        "tool": "metro_graph_seed.py v1"
      }
    },
    "1AcKJRMqT38DTZMdThbnc96hylLIeEXRb": {
      "fileId": "1AcKJRMqT38DTZMdThbnc96hylLIeEXRb",
      "city": "Munich",